{
  "$schema": "http://json-schema.org/draft-07/schema#",
  "$id": "https://www.koia.io/assets/scene-format/1.0/scene.schema.json",
  "title": "SceneDocument",
  "description": "Scene document in the CouchDB database 'scenes', format 1.0",
  "type": "object",
  "required": ["creationTime", "name", "shortDescription", "database", "columns"],
  "properties": {
    "_id": {
      "type": "string",
      "description": "scene id, generated by CouchDB when omitted"
    },
    "_rev": {
      "type": "string",
      "description": "CouchDB revision, omitted on insert"
    },
    "schemaVersion": {
      "type": "string",
      "pattern": "^[0-9]+\\.[0-9]+$",
      "description": "scene format the document complies with; documents without it are read as format 1.0"
    },
    "creationTime": {
      "type": "integer",
      "description": "creation time in milliseconds since the epoch; scenes without it are not listed by Koia"
    },
    "name": {
      "type": "string",
      "minLength": 1
    },
    "shortDescription": {
      "type": "string"
    },
    "database": {
      "type": "string",
      "minLength": 1,
      "description": "name of the CouchDB database that holds the entries of the scene"
    },
    "context": {
      "type": "array",
      "description": "name/value pairs describing the origin of the data",
      "items": { "$ref": "#/definitions/contextInfo" }
    },
    "columns": {
      "type": "array",
      "minItems": 1,
      "items": { "$ref": "#/definitions/column" }
    },
    "config": { "$ref": "#/definitions/config" }
  },
  "definitions": {
    "column": {
      "title": "SceneColumn",
      "type": "object",
      "required": ["name", "dataType"],
      "properties": {
        "name": {
          "type": "string",
          "minLength": 1,
          "description": "column name, equal to the property name in the entries"
        },
        "dataType": {
          "type": "string",
          "enum": ["Boolean", "Number", "Object", "Text", "Time"],
          "description": "Time values are milliseconds since the epoch, Object values are JSON strings"
        },
        "width": {
          "type": "number",
          "minimum": 0
        },
        "format": {
          "type": "string",
          "description": "display format of Time values (e.g. 'yyyy-MM-dd HH:mm:ss,SSS')"
        },
        "indexed": {
          "type": "boolean",
          "description": "requires exactly one CouchDB index on this column in the entries database"
        }
      }
    },
    "contextInfo": {
      "title": "ContextInfo",
      "type": "object",
      "required": ["name", "value"],
      "properties": {
        "name": { "type": "string" },
        "value": { "type": "string" }
      }
    },
    "config": {
      "title": "SceneConfig",
      "description": "owned by Koia; writers of format 1.0 SHOULD write {\"records\":[],\"views\":[]}, the form accepted by every Koia deployment",
      "type": "object",
      "properties": {
        "records": { "type": "array", "items": {} },
        "views": { "type": "array", "items": {} }
      }
    }
  }
}
